dept,code,group_logo,embed_link,group_name,proponents,main_categ,sub_categ,title,abstract,abstract_raw,sdg
CE,CIV-35,https://drive.google.com/file/d/13bnHZ5GErr5b9YARGRW6mGDgzr_Tn23r/view?usp=share_link,https://drive.google.com/uc?export=view&id=13bnHZ5GErr5b9YARGRW6mGDgzr_Tn23r,RETRO,"DESALES, Kevin M., TENDING, Ivy Corinne G., BERNARDO, Krizia Kenise R., DEL BARRIO, Jomar, LEGASPI, Frinz Lenard C., ROCES, Beatrice Xzandrine R., SAGAL, Jan Christopher M.",Civil,Material and Field Testing,Compression Behaviour of Axially Loaded Short Reinforced Concrete Column Retrofitted Using Bamboo Reinforced Concrete Jacket with Varying Transverse Reinforcement Configuration,https://drive.google.com/open?id=1tsbCcXEkjZZ1lIJT0CcJif0BkThq8nZX,"Many reinforced concrete structures suffer deterioration as a result of poor construction, excessive
loading, errors or changes in design codes, poor maintenance, and environmental exposure. The
demand for a reliable retrofitting technique for reinforced concrete structures is growing. While steel,
an expensive and unsustainable material, is scarce in many regions of the world, a sustainable material
is needed. The use of bamboo (Bambusa spinosa) as replacement for steel reinforcing bar was
analyzed in this study. A number of damaged reinforced concrete column specimens were fabricated
using a 3000-psi concrete design mix. The control columns were subsequently retrofitted with
bamboo reinforced concrete jackets of varied transverse reinforcement configurations spaced at 70
mm, 60 mm, and 50 mm. Among the fifteen (15) damaged columns, three (3) were retrofitted with
steel reinforced concrete jackets. After compression tests, the axial capacity, ductility, and
deformation of the specimens were recorded and analyzed. The analysis was completed by comparing
the capacity of control columns—damaged and undamaged—with the capacity of retrofitted columns.
The data showed that bamboo reinforced concrete jacketing increased the capacity and ductility of the
damaged columns, given that the bamboo lateral ties spacing was more confined. The results have
proved that a bamboo reinforced concrete jacket is a feasible retrofitting method for RC columns.",SDG: Goal 11: Sustainable Cities and Communities
CE,CIV-36,https://drive.google.com/file/d/1kOUuAhPjga4S-69o9Ayol7H6T37050Uk/view?usp=share_link,https://drive.google.com/uc?export=view&id=1kOUuAhPjga4S-69o9Ayol7H6T37050Uk,SAMSON TECH,"BERSAMINA, Juan Paulo L., PALLEGA, Sheina R., SAMSON, Clarence John J., BARTOLOME, Alyssa Noreen E., CABALLERO, Janella Maxine D., JAVIER, Jielene Sarah B., SACE, John Patrick Z.",Civil,Material and Field Testing,Assessment of Building Condition and Accommodation Capability of Spaces of Technological University of the Philippines - Manila Campus to Aid in Campus Development,https://drive.google.com/open?id=110FhW2Dn2fvP-Zjh42_ij39OeVvInw95,"Technological University of the Philippines (TUP-M) is one of the premier state universities in the
Philippines. To accommodate its growing community, updated facilities and infrastructure are
essential. This study will assess the current state of TUP-M campus and suggest future development
plans to aid in the campus growth, only focusing on existing land conditions and excluding utilities.
The approach uses Quantum Geographic Information System (QGIS) and Autodesk Computer Aided
Design (AutoCAD) to create a campus representation, incorporating data from university departments
and studies. A perception survey will then be conducted with users of the campus facilities and
spaces, specifically, students and faculties. Data will be analyzed using descriptive statistics while
inferential statistics will involve Analysis of Variance (ANOVA) and Tukey test. The Infrastructure
Audit Manual (IAM) and Local Infrastructure Audit Form (LIAF-1) will be used as a guide for the
structural assessment, with a licensed civil engineer providing supervision and guidance. The
assessment will provide insights into the university&#39;s current state and user’s perception of the
campus. With these data, the study will identify the issues and problems of the campus and suggest
improvements in functionality, sustainability, and safety of the campus spaces and facilities. The
study&#39;s outcome will be valuable for the university&#39;s administration in planning future development
and improving the campus experience for its faculties and students.",SDG: Goal 11: Sustainable Cities and Communities
CE,CIV-37,https://drive.google.com/file/d/1JebvDSOOULJJI4l4vqvdC5Rtm2te6mMw/view?usp=share_link,https://drive.google.com/uc?export=view&id=1JebvDSOOULJJI4l4vqvdC5Rtm2te6mMw,Seaweed,"ARAPO, Rommel G., ABRANTES, Maria Lyn A., ALVIZ, Charles Isaac E., ARNALDO, Kenneth P., GERONIMO, Clarisse Ann R., LUSTRE, Raymond S., ROSALES, Hannah Nicole J.",Civil,Material and Field Testing,Fire Retardancy Capacity of Intumescent Fire-Retardant Coating Reinforced with Brown Algae (Sargassum) Bio-filler,https://drive.google.com/open?id=13SMk1zkYrjdTAIs7Jb2F-8YvTu2MiF62,"Incorporation of synergists has proven to be an effective way to improve the properties of intumescent
fire-retardant (IFR) coating as it slows down the speed of combustion of flammable materials such as
plywood that is widely used in the construction industry. This study addresses the drawbacks of fire-
retardant system by incorporating brown algae as an eco-friendly bio-filler. Preparation of IFR coating
was attained by adding brown algae bio-filler (BABF) to the IFR system consists of a carbon source;
pentaerythritol (PER), an acid source; ammonium polyphosphate (APP), and a gas source; melamine
(MEL). Different mix designs were utilized to determine which concentration achieves the most superior
synergistic effect. Standard testing methodologies were used to assess the influence of BABF to the fire
performance of the coatings particularly ASTM E69 through Fire-Tube Test. The results showed that the
addition of BABF improved the fire protection property of the coatings as 4 out of 5 specimens (B, C, D,
and E) neither showed surface spread nor afterglow combustion upon exposure to fire. Formulation C,
with a mass fraction of 5% BABF, exhibited the optimum synergistic flame-retardant effects parallel to its
thermal stability and char formulation performance. Additionally, specimens formulated with BABF
showed excellent water resistance and adhesion strength. Significantly, a new environmentally friendly
bio-filler such as BABF evidently enhanced the mechanical and thermal properties of IFR coating.","SDG: Goal 9: Build Resilient Infrastructure, Promote Inclusive and Sustainable Industrialization and
Foster Innovation."
CE,CIV-38,https://drive.google.com/file/d/1XGOOxQwPS0u2A19jC8h2LDnR9T6N77fZ/view?usp=share_link,https://drive.google.com/uc?export=view&id=1XGOOxQwPS0u2A19jC8h2LDnR9T6N77fZ,Seismo,"BERSAMINA, Juan Paulo L., ZAPANTA, Romie M., BARROGA, Ronnel Justine B., DUEÑAS, Gerald Vincent C., LEGACION, Mark Tovie R., REYES, Mary Jon S., VILLAS, Carey John P.",Civil,Material and Field Testing,Post-Seismic Assessment and Retrofitting of a Two-Storey Reinforced Concrete School Building Damaged in the Magnitude 7.0 Northwestern Luzon Earthquake Utilizing Nonlinear Dynamic Time-History Analysis in SeismoStruct,https://drive.google.com/open?id=1iWdqZBVfF_68EnfF3Lf24UNyYEWkaUuY,"The Philippines is highly susceptible to earthquakes due to its geographic location in the
Pacific Ring of Fire, which makes most of its infrastructure vulnerable to earthquake damage.
Northwestern Luzon earthquake with magnitude 7.0 recently damaged several facilities,
including schools, emphasizing the importance of assessing their seismic performance and
retrofitting them to better withstand earthquakes and other seismic events. Thus, in this paper,
the researcher aimed to evaluate the seismic behavior of a two-storey reinforced concrete
school building situated in Dugong Elementary School, Bucay, Abra that suffered structural
damages after the July 27, 2022 Magnitude 7.0 Northwestern Luzon earthquake and suggest a
retrofitting method such as reinforced concrete (RC) jacketing and fiber reinforced polymer
(FRP) wrapping. Nonlinear dynamic time-history analysis in SeismoStruct software was
utilized in this study to simulate the actual earthquake ground motions acquired from
Philippine Institute of Volcanology and Seismology (PHIVOLCS) and determine the
damaged and retrofitted building&#39;s seismic response. The structural response of the damaged
and retrofitted models was analyzed and compared. The results of the comparison revealed
that using RC jacketing in the damaged building was the most efficient way of lowering the
demand capacity ratio (DCR) of structural components, maximum roof displacements, and
building fundamental period. The findings of the time-history analysis of the building
retrofitted with RC jackets show that the capacity curve have increased significantly.","SDG: Goal 9: Industry, Innovation, and Infrastructure"
CE,CIV-39,https://drive.google.com/file/d/11o6tKIlICFmiu4DGugrfrHQlo--a9lrx/view?usp=share_link,https://drive.google.com/uc?export=view&id=11o6tKIlICFmiu4DGugrfrHQlo--a9lrx,Sixth Sense,"GARCIA, Teodinis P., CALMA, George M., SANTOSIDAD, Crislyn C., ACOSTA, Darla Ansherina B., AROGANTE, Yveth E., FLAVIER, Andrea Claire M., NIEGAS, Kimberly Mae., ROA, Angela Mae R.",Civil,Material and Field Testing,"Influence of Type of Binder on the Physical, Mechanical and Thermal Properties of Particleboard Using Spent Coffee Grounds and Sawdust",https://drive.google.com/open?id=1gNKaMY4d8wu7iSkdSxEYnE-mpY52z4Fh,"Particleboard is an engineered wood product commonly used in construction. The researchers
developed a particleboard that utilizes Spent Coffee Grounds (SCG) and Sawdust as raw material and
Polyvinyl Acetate (PVAc), Polyurethane Adhesive (PUR), and Epoxy Resin (ER) as binders. Thus,
this study focuses on determining the influence of PVAc, PUR, and ER as binders in producing
particleboard made from SCG and Sawdust and testing its physical, mechanical, and thermal
properties to compare to the Philippine National Standard (PNS 230:1989) Specification for
Particleboards. Twenty-seven particleboards were prepared with 40%, 50%, and 60% adhesive. The
raw materials were mixed with PVAc, PUR, and ER as binders respectively. The boards were made by
applying pressure manually to maintain 30x30x1.2cm board size. ASTM D-1037 standard was used to
evaluate physical properties and mechanical properties. On the other hand, ASTM C-177 was used to
evaluate thermal conductivity of the particleboard. The results showed that in terms of physical and
mechanical properties, the mix designs MA-40-2, MA-50-2, MA-60-2, MR-40-2, MR-50-2, MR-60-
2, ME-40-2, ME-50-2, and ME-60-2 all conform to the requirements set by PNS 230:1989. The
results indicated that the suitable proportion of SCG and Sawdust is 50:50. Furthermore, all optimum
mix design showed low thermal conductivity as heat transfer transpired at a gradual rate. In
conclusion, the proportion of PVAc, PUR, and ER influence the property of particleboard made from
SCG and Sawdust significantly. Nonetheless, this signifies that the particleboards made from SCG
and Sawdust bonded with PVAc, PUR, and ER are qualified for construction use.",SDG: Goal 12: Responsible Consumption and Production
CE,CIV-40,https://drive.google.com/file/d/1h71aNQXIVqVW00Rq7I41CvLjr08NaoG7/view?usp=share_link,https://drive.google.com/uc?export=view&id=1h71aNQXIVqVW00Rq7I41CvLjr08NaoG7,Team Bamboo,"DESALES, Kevin M., PINEDA, John Joferson G., ABAD, Joshua Joaquin B., DELA PEÑA, Kaycee G., DIAZ, Sofia Ysabel S., ENRIQUEZ, Ericko Andrie R., GONZALES, Audrilyn Rocel A.",Civil,Material and Field Testing,Strength Performance Analysis of Various Type of Joint Connections for Kawayan Tinik (Bambusa blumeana) Bamboo Scaffolding,https://drive.google.com/open?id=19_h8w5z51Bl603lxOOsAy8XaFVEdHh8U,"Bamboo scaffolding is in a precarious state of usage due to a shift to other construction areas despite
being an efficient and environmentally friendly alternative to traditional steel scaffolding. In an
attempt to update bamboo scaffolding technology to remain competitive in the market, and promote
environmentally friendly alternatives for the construction industry, different connections (namely: (1)
drilled lashing method using rattan, (2) clamping using conduit metal clamp double hole bolted with
flat bars, (3) swivel coupler clamp, and (4) prefabricated steel tube) for Bambusa blumeana
scaffolding is tested to yield the most effective connection in producing a prototype H-frame
scaffolding. Bambusa blumeana is collected, air dried, and treated with solignum before being cut into
desired specimen size for both physical and mechanical property testing. The testing of physical
property is in accordance with ASTM D 1037-99 Method B (Single 24-h submersion period) for
thickness swelling and water absorption method. For the moisture content and specific gravity, the
test is conducted in accordance with Method B (Volume by Water Immersion) Mode I of ASTM D
2395. On the other hand, the ASTM D 143-94 Standard Test Methods for Small Clear Specimens of
Timber is used to obtain the mechanical properties of the bamboo. The results gathered in the physical
and mechanical properties testing of bamboo is utilized in the analysis and design process of the
bamboo scaffolding using the four different connections. The connections are tested in accordance
with ASTM D 5652 (Standard Test Methods for Bolted Connections for Wood and Wood Based
Products) for both compression and tension strength and is compared to a standard design load to set
parameters in yielding the most effective connection that is used in producing a prototype H-Frame
scaffolding.",SDG: Goal 11: Sustainable Cities and Communities
CE,CIV-41,https://drive.google.com/file/d/18PVjIKUF3J2JDO5t_evU9xO5gd3uhGiK/view?usp=share_link,https://drive.google.com/uc?export=view&id=18PVjIKUF3J2JDO5t_evU9xO5gd3uhGiK,Team Clay Bricks,"DESALES, Kevin M., ABESAMIS, Erika Renz N., EBIO, Rachel Ann O., GARCIA, Rolando David T., GLOMAR, Karla Marxia G., TRINIDAD, Andrea C., YBAÑEZ, Jed G.",Civil,Material and Field Testing,Assessment of Physical and Mechanical Properties of Modified Clay Facing Brick with Corn (Zea mays) Cob Ash as Partial Replacement for Clay Soil and Banana (Musa padisiaca) Fiber as Reinforcement,https://drive.google.com/open?id=1JZon07AJrT1El0v02G4oD2ipkzuznoHT,"Agricultural wastes are one of the major concerns, bananas and corn are leading as one of the most
consumed foods as they are common in the country and readily available anywhere, making banana
stems and corn cobs a vast waste. Along with this, studies have shown that clay bricks are being
incorporated with wastes as clay bricks are proven to be durable, as structures using these materials
are still standing today. This study aims to use corn cob ash as a replacement for clay soil and banana
fiber as reinforcement in clay facing bricks and assess their physical and mechanical properties. X-ray
fluorescence (XRF) elemental analysis spectrometry determined the chemical compositions of banana
fibers, corn cob ash, and clay soil. Brick hand molding was used to shape the clay mixes into bricks
by using a metal mold (50.8 mm x 50.8 mm x 203.2 mm). The brick samples were fired in a kiln at
1000 °C for 24 hours. Clay facing bricks with varying weight percentages of corn cob ash and banana
fibers were tested their physical (water absorption test, efflorescence test, and dimensional stability
test) and mechanical (initial rate of absorption, flexural strength test, and compressive strength test)
properties in accordance with ASTM C67-05.","SDG: Goal 9: Industry, Innovation and Infrastructure"
CE,CIV-42,https://drive.google.com/file/d/1Xn1YjWVC5-ZGf72mBzFzTGeL6TgAh3S8/view?usp=share_link,https://drive.google.com/uc?export=view&id=1Xn1YjWVC5-ZGf72mBzFzTGeL6TgAh3S8,VICI,"ORTEGA, Lucia V., PELAYO, Jade Allyson P., MARCOS, Mariniell G., PIAMONTE, Hannah Grace D.",Civil,Material and Field Testing,The Effects of Liquefaction-induced Settlement to the Shallow Foundation of a Mid-rise School Building using Plaxis 2D,https://drive.google.com/open?id=1fkjIKXVvBMnAEXYonWvyUdpn59aqksAG,"Due to its location in the Pacific Ring of Fire, the Philippines has always been anticipating potential
destructive earthquakes that could severely damage important structures like schools. The City of Manila
is one of the locations that is highly susceptible to liquefaction, making any structures built on its soil
vulnerable to liquefaction-induced settlement brought on by earthquake loads. Settlement can result in a
variety of structural damage to the building, from small settlement that will start to jeopardize the
integrity of the structure to general failure brought on by a reduction in soil bearing capacity. This study
aims to demonstrate the difference in the bearing capacity of the underlying soil and foundation of a low-
rise school building in the highly susceptible to liquefaction soil of Manila using Finite Element Software,
PLAXIS 2D to illustrate the difference of soil bearing capacity and the building settlement before and
after the earthquake loads are applied.",SDG: Goal 11: Sustainable Cities and Communities
CE,CIV-43,https://drive.google.com/file/d/1dQZ9xiqEDwZRJHXEO_VflrnsOf7bcz63/view?usp=share_link,https://drive.google.com/uc?export=view&id=1dQZ9xiqEDwZRJHXEO_VflrnsOf7bcz63,Water Benders,"ESCURO II, Teodimer M., LEGASPI, Edgardo S., PANDAAN, Sheila Joy S., AQUINO, Joaquin Jose E., BERMUNDO, Yhoniel M., CAJUCOM, Geona Maureen L., MALABOTE, Sheina Mea L.",Civil,Sustainable and Environmental Engineering,"Application of Coagulation Processes in Wastewater Treatment Using Natural, Chemical, and Electro-coagulation in Treating Household Laundry Wastewater: A Comparative Study",https://drive.google.com/open?id=1njBX6F3SugB-mYjkVG20Oagek0pOSk7G,"The thesis paper seeks to provide valuable insights into the feasibility and practicality of using the
three coagulation processes which are Natural Coagulation using malunggay (Moringa oleifera) seeds,
Chemical Coagulation using Polyaluminum Chloride (PACl), and Electro-coagulation using
aluminum electrodes integrated into a wastewater treatment process for household laundry wastewater
treatment, with the potential to improve the efficiency and affordability of the wastewater treatment
process. This study aims to compare the effectiveness, preparation time, and production cost of these
coagulation processes for treating household laundry wastewater. In order to fulfill this study,
gathering and preparation of materials or controlled variables are needed, and an integrated system
will be used that is focusing primarily in the effectivity of the three coagulation processes showing
their own way of wastewater treatment. The effectivity of the coagulation processes will be tested
under the Significant Effluent Standard Parameters of the Department of Natural Resource (DENR)
which proves whether the sample had really removed or reduced the unwanted toxic particles and
flocs present inside the laundry wastewater which makes it harmful to the environment if neglected.
Results from the testing of wastewater is expected to show positive outcomes from the three
coagulation processes from the significant effluent standard in terms of effectivity.",SDG: Goal 6: Ensure Availability and Sustainable Management of Water and Sanitation for All
CE,CIV-44,https://drive.google.com/file/d/1KCDJK72cNopf_pthX6tCuTf7xDVYhgiC/view?usp=share_link,https://drive.google.com/uc?export=view&id=1KCDJK72cNopf_pthX6tCuTf7xDVYhgiC,Water Hyacinth Elves,"GARNA, Jasinne C., LEGASPI, Edgardo S., CANICOSA, Benedict S., ACUIN, Joy G., FLORES, Sen Angelo D., PADILLA, Cinlly Mae B., ROSARY, Raymond M., SIKAT, Ryan Joseph U.",Civil,Material and Field Testing,Property Characterization of Water Hyacinth Plastic Composite Roofing Sheet Utilizing Epoxy Resin Binder,https://drive.google.com/open?id=12Gvnh-hOXj61F7gMt04ApQ6kXMf-sEIa,"Water hyacinth has taken over freshwater systems in more than 50 countries on five continents. With
its capacity to reproduce at an amazing pace, water hyacinth is the most harmful aquatic plant
globally. Corrugated roofing sheets are light and have been used for many years in many different
ways, such as on agricultural and industrial buildings. The structure of the corrugated sheet is what
makes it such a dependable and long-lasting option for use as a roofing material which made it the
most preferred roof for residential and commercial use in the Philippines, according to the latest
market research. As such, the researchers of this study aimed to produce a Plastic Composite Roofing
Sheet (PCRS) that consists of water hyacinth stalks and resin. The water hyacinth stalks were treated
using Sodium Hydroxide (NaOH) with an aqueous solution (10% w/w) and immersed for 4 hours then
the stalks were rinsed with distilled water. A Constant Rate of Extension (CRE) type of Tensile
Testing Machine was used to examine the tensile strength of a single fiber water hyacinth. The stalks
were patterned in a variety of geometrical arrangements such as Unidirectional, Plain Weave and
Twill Weave. The PCRS underwent different Physical and Mechanical Tests. The result of the treated
stalks yields 10.7 MPa for its tensile strength. The test concluded that Water Hyacinth Stalks
enhanced the overall capability of PCRS and the best geometric arrangement based on experiment is
the Unidirectional Alignment.","SDG: Goal 9: Industry, Innovation and Infrastructure"
CE,CIV-45,https://drive.google.com/file/d/1K8FsNlfZbVcySPbr7bk08RrEvPyCfju3/view?usp=share_link,https://drive.google.com/uc?export=view&id=1K8FsNlfZbVcySPbr7bk08RrEvPyCfju3,WHANANA,"CALMA, George M., LEGASPI, Edgardo S., AGUSTIN, Rossana A., BUCASAS, Kurt Lester C., HIZOLE, Stephanie Danielle G., PUYONG, Arian Mae R., VISDA, Krystian Junie S.",Civil,Material and Field Testing,Property Characterization of Concrete with Water Hyacinth Ash and Banana Peel Pectin as Partial Replacement to Cement,https://drive.google.com/open?id=1sLeU4Fc-aFTQqt8M_n_t_TEjP5jKZG_l,"The study investigated Water Hyacinth Ash (WHA) together with banana peel pectin as partial
replacement to cement. As there is a continuous problem of invasive water hyacinth that infests water
bodies and high amounts of waste produced from bananas which have no immediate use, they came as
convenient raw materials for our study to use, where the demand for cement these days constantly
increases and causes CO² emissions. With that said, the general objective of the study is to characterize
the properties of concrete with WHA and banana peel pectin as partial replacement to cement. The fresh
and mechanical properties are to be tested to establish the efficiency of using WHA and banana peel
pectin as partial cement replacement. A control group of 100% Portland Cement, and a treatment group
with three different cement replacement percentages such as 5%, 10%, and 15%, with five different
material ratios each (100:0, 75:25, 50:50, 25:75, 0:100). A Microwave-assisted extraction process was
conducted for the pectin in accordance with the procedure of Rota et al. (2018). Results from FTIR
Analysis showed that the produced pectin was similar to commercially available pectin, WHA underwent
WD-XRF Analysis to show that it contained pozzolanic materials. Although testing is still on-going, the
mix design of 10% replacement with 75% WHA and 25% pectin, showed better results in terms of
mechanical properties compared to the other mix designs.","SDG: Goal 9: Industry, Innovation, and Infrastructure"
