dept,code,group_logo,embed_link,group_name,proponents,main_categ,sub_categ,title,abstract,abstract_raw,sdg
ME,MEC-34,https://drive.google.com/file/d/1nPKYQd-Stg8VKMDxhcS50Z8WX2u2Ra0J/view?usp=share_link,https://drive.google.com/uc?export=view&id=1nPKYQd-Stg8VKMDxhcS50Z8WX2u2Ra0J,THESIS8,"MAG-ISA, Alexander E., MALVAR, Philippe Andrei, ALEDIA, Ramil, SALANGO, Lester John L., ANDRADE, Christian Loyd A., FALCOTELO, Alan Jan Caleb S., HEMBRA, Kayleigh B., LORETO, John Bryan P., MARZO, Joselle P., MOJICA, John Renz A., ROGANDO, Jethro Cyron G.",Electromechanical,Mechanical Engineering Laboratory Apparatus,Design and Development of Capillary Tube and Bare Tube Evaporator of a Refrigeration Training Unit,https://drive.google.com/open?id=1kIRRKxcA0qkPGpxpnsofdyRy9hNcn9i2,"With the world advancing rapidly in technology, it&#39;s essential that engineering students are well-
equipped with the necessary knowledge to succeed in this society. This study aimed to design and
developed capillary tube and bare tube evaporator of a refrigeration training system that is optimized
for used as laboratory experiment machine. The design involved the fabrication of a bare tube
evaporator and capillary tube, with the goal of achieving minimal pressure drop and a high overall
heat transfer coefficient. The study also included a comparison of the performance of capillary tube
and thermostatic expansion valve systems in identical refrigeration setups.
The bare tube evaporator and capillary tube were carefully designed to achieve a high overall heat
transfer coefficient of 319.71 W/m3-K and minimal pressure drop. The optimization of the system is a
key contribution of this research and will provide students with practical insights into evaporator and
refrigeration system design. To assess the relative performance of the capillary tube and thermostatic
expansion valve systems, the researchers conducted a t-test on the cooling capacity and coefficient of
performance (COP) data collected from the two systems. The results indicated that while the TXV
system exhibited slightly higher cooling capacity and COP, the difference was not statistically
significant (p > 0.05).
The developed system is intended for use in laboratory classes for mechanical engineering students at
the Technological University of the Philippines - Cavite. This paper represents a valuable contribution
to the field of refrigeration training and provides a practical tool for teaching refrigeration principles.",SDG: Goal 4: Quality Education
ME,MEC-35,https://drive.google.com/file/d/1AMmS7O76hR18aD26sw2UVriXOBZydKfy/view?usp=share_link,https://drive.google.com/uc?export=view&id=1AMmS7O76hR18aD26sw2UVriXOBZydKfy,Three Johns,"CA-AY, Antiro M., YAP, Alyanna M., CELIS, John Gabriel V., LANDICHO, John Mark R., MALUBAY, Annika Cassandra B., and MORALES, John Kealvin M.",Electromechanical,Mechanical Engineering Laboratory Apparatus,Design and Development of a Centrifugal Fan Test Rig for Mechanical Engineering Laboratory at Technological University of the Philippines-Manila ,https://drive.google.com/open?id=10-_QoMpl7fubnBBcFHCdaJW7qBZqf0xw,"The project focuses on the design and development of a centrifugal fan test rig as a modular
laboratory equipment for educational purposes in the field of Mechanical Engineering (ME),
in which knowledge of it is useful in many industrial applications. The comparison between
traditional damper systems and variable frequency drives (VFDs) is also explored to evaluate
their efficiency and suitability for future applications. The study involves the design and
development of the centrifugal fan test rig with operating condition of 500 Pa, 400 CFM, and
3500 RPM, and the implementation of various experiments. These experiments include the
determination of static pressure, velocity pressure, total pressure, velocity, and volume flow
rate using various measuring instruments according to their configurations. The performance
evaluation of the centrifugal fan is also conducted, along with the determination of the fan
performance curve using the affinity laws. This project complies with the minimum
requirements for ME Laboratory, specifically fan test rig as one of the apparatuses required
by CHED Memorandum Order (CMO) No. 97, Annex IV, B (Commission on Higher
Education, 2017). As of the date, there is no results nor conclusion that can be provided since
the apparatus is still in the middle of installation and testing.","SDG: Goal 9: Industry, Innovation and infrastructure"
ME,MEC-36,https://drive.google.com/file/d/1rfR8M7zhkmUTWQTRltFOkI1JB-o71OqA/view?usp=share_link,https://drive.google.com/uc?export=view&id=1rfR8M7zhkmUTWQTRltFOkI1JB-o71OqA,Toobig: Distilled Water,"GAZO, Alvin U., FORTALEZA, Benedicto N., GALLARDO, Jerome S., BRUAN, Justine Lance G., DEL ROSARIO, Jerimy R., LOLO, Christian T., WAGNER, Michael James S.",Electromechanical,Sustainable and Environmental Engineering,Production of Distilled Water using Hybrid Solar Still with Two Separate Rainwater Basin,https://drive.google.com/open?id=1pzUweEQkhloG0hqzHPK3S1W3HLv3T62B,"Access to clean water remains a significant issue in the Philippines, with regional disparities ranging
from 62% to 100% in basic water services. This thesis addresses this challenge by designing and
fabricating a hybrid solar still with two separate rainwater basins capable of producing at least 5 liters
of distilled water per operational day. The machine utilizes an electric heating system in conjunction
with solar evaporation for faster and safer distillation. The objectives of the study include testing the
quality of the distilled water according to the Philippine National Standards for Safe Drinking Water,
evaluating the production of distilled water using solar energy and heating coil, and presenting an
economic analysis of the rainwater distiller. The researchers utilized AutoCAD and SolidWorks for
the design and fabricated the machine through a custom-fabricator. Results show that 5 liters of
distilled water were produced using a combination of solar energy and heating coil. The distilled
water passed the parameters for safe drinking water and was cheaper compared to other commercial
brands. In conclusion, the hybrid solar still with two separate rainwater basins is an efficient and cost-
effective solution for producing potable and safe drinking water in the Philippines. The study&#39;s
findings could significantly contribute to addressing the challenge of providing access to clean water,
particularly in areas where basic water services are inadequate.",SDG: Goal 6: Ensure availability and sustainable management of water and sanitation for all.
ME,MEC-38,https://drive.google.com/file/d/1zVp__z8CsLCdu02izloIJy_rKxChCAqy/view?usp=share_link,https://drive.google.com/uc?export=view&id=1zVp__z8CsLCdu02izloIJy_rKxChCAqy,WATER HYACINTH DRYER WITH PRESSER,"DELA CRUZ, Virgilio S., FORTUS, Vincent John A., CANALES, Jashie Mae A., RELOJ, Antonette Renee S., REY, Zachariah Timothy D., SARAHINA, Precious Mae P.",Electromechanical,Smart Agriculture,Design and Development of Water Hyacinth Dryer with Presser for Handicraft Products,https://drive.google.com/open?id=12kPdr1G9a6vcmFWsyugOGQ8UPjo7MeNQ,"Water hyacinth is an invasive aquatic plant that has a rapid rate of reproduction, and it causes
negative effects in the surroundings especially to underwater organisms and bodies of water. The
plant aggravates the water quality by blocking the sunlight form underwater species and clogs
waterways that can cause flooding. San Miguel, Bulacan is one of the communities that is
experiencing excessive flooding due to the increasing number of water hyacinth in the area. The
San Miguel Water Lily Producers Association was established to create handicraft products made
of dried water hyacinth stalks to turn the problem into a valuable commodity and lessen the
number of water hyacinth in the neighborhood. The association utilizes a sun drying procedure
that takes 3-5 days to dry water hyacinth stalks depending on the weather. Following the drying
process, the members uses a manual presser to compress the dried water hyacinths to the desired
thickness. To make these processes efficient, the researchers in this study aimed to develop a
water hyacinth dryer with an adjustable motor-powered roller that is capable of producing no
less than150 dried water hyacinth stalks within 4-6 hours. An average moisture content between
85-90% will be eliminated during the drying process. The pressed dried water hyacinth stalks&#39;
thickness will not exceed no more than 2 mm. After reaching the desired thickness, the output
can be used to create handicraft products that will help our beneficiary San Miguel Water Lily
Producer Association from San Miguel, Bulacan improve their production method.",SDG: Goal 8: Decent work and Economic Growth
ME,MEC-40,https://drive.google.com/file/d/1WQ13XbqbVUWmMh7F1vz1AdmaIb33IVEN/view?usp=sharing,https://drive.google.com/uc?export=view&id=1WQ13XbqbVUWmMh7F1vz1AdmaIb33IVEN,KUHAMOTECH,"MACALINTAL, Edwin G., LODRIPAS, John Roy M., ACOSTA, Mc Christian M., BACSID, Sherwin M., BALAYO, Gerald Vince C., CAMAGONG, John Joshua J.",Electromechanical,Smart Agriculture,"Design and Development of a Sweet Potato Harvester for Brgy. Palale, Gen. Tinio, Nueva Ecija",https://drive.google.com/open?id=10y3R8q7Mqw535_z0Ynra6_8K36l0YgOb,"Equipments in our time are so advanced in many ways especially in making things convenient for us
people. In farming, machines and equipments are also advanced in industrial and commercial. In
terms of domestic farming or small farming, the equipment we used in harvesting are not that
convenient for farmers to use. The aim of this study is to design and develop a farming machine
consisting of an elevator-separator powered by a mechanical power transmission and a fork in front,
that uses a durable, sturdy, and composed of materials available in the market. Based on related
studies of farming machine used for harvesting crops, a survey was distributed to potential farmers of
sweet potato that tried to use the developed machine, Respondents were the workers of the farm that
tested and observed the machine. Analysis of the respondents demonstrated the quality and
performance of the machine powered by mechanical transmission were convenient for the farmers to
use in terms of time efficiency. The results indicated that the machine does have a huge impact in
increasing the time efficiency, effectiveness in harvesting sweet potato crop than usual way of
harvesting without it and the convenience that the farmers experienced using the designed machine.
On this basis, it is recommended the use of the designed machine to increase the time efficiency,
effectiveness, and the convenience it brings to the farmers for harvesting sweet potato crop.",SDG: Goal 2: Zero Hunger
ME,MEC-41,https://drive.google.com/file/d/15TYnlf27vhIz7V-wSAwDNxVOi5faZSO0/view?usp=sharing,https://drive.google.com/uc?export=view&id=15TYnlf27vhIz7V-wSAwDNxVOi5faZSO0,Angat Buhat,"DELOS REYES, Jay Mark P., BALANSAY, John Carl N., ATENDIDO, Lorenzo U., ATINAJA, Ryan James H., LIM, Marc Gean C., NILLO, James S.",Electromechanical,Industrial Control and Automation,Design and Fabrication of a Water Container Lifter Attachment for Water Dispensers,https://drive.google.com/open?id=1ST8rf7QERlbOPPiKLt4w__-MOpuE9OYV,"Water dispensers have been widely adopted in various settings such as offices, schools, and workplaces due to their practicality and usefulness. Over the years, significant improvements have been made to enhance their efficiency, cooling systems, and functionality, including the addition of features like dispensing lukewarm and hot water. However, there is still room for improvement, particularly in automating the process of restocking water dispensers so that no physical work is required. Studies have shown that carrying heavy loads, such as replacing a 5-gallon water bottle in a dispenser, can lead to musculoskeletal ailments in both men and women. These injuries contribute to the top 10 causes of years lost to disability (YLD). Furthermore, strenuous activities like heavy lifting have been associated with an increased risk of cardiovascular diseases, including irregular heartbeat rhythm. This study focuses on designing a machine that aims to address a specific problem: lifting a water gallon without requiring human effort. The proposed solution involves the development of a machine that utilizes winch mechanism to facilitate the lifting process. The machine's structure will be constructed using mild steel frames to ensure stability and durability. Furthermore, the mechanical operations of the lifter will be initiated using a simple control method such as limit switches. The primary objective of this machine is to successfully lift a water gallon, offering a solution to the problem at hand.","SDG: Goal 9: Industry, Innovation, and Infrastructure"
ME,MEC-45,https://drive.google.com/file/d/1L-ERvFyAyWhOsLOf4rNmi7NbPbDawgRO/view?usp=share_link,https://drive.google.com/uc?export=view&id=1L-ERvFyAyWhOsLOf4rNmi7NbPbDawgRO,Briquetting Machine,"GONZALO, Salvador Jr., ACHAVAN, Lemuel T., ATENDIDO, Diony Jr. C., DEROCA, Mhark Deilan A., GUEVARA, Llander O., NAHIBUAN, Jhon Ashley N.",Electromechanical,Industrial Control and Automation,Design and Development of Screw-Extruder Briquetting Machine for Production of Charcoal Briquettes,https://drive.google.com/open?id=1wuCRIae_yYwgrXmk2N73pKuk8GXhTyio,"The Philippines&#39; briquetting technique is still in need of certain improvements. Wood is becoming a
limited resource in many regions of the developing countries. Briquettes made from agricultural waste
like coconut shell can be used as an alternative domestic solid fuel, especially in rural regions.
Agricultural waste has surged in developing nations like the Philippines and coconut shell is an
agricultural byproduct that is abundantly accessible in tropical nations. These problems could be
addressed through “Design and Development of an Automatic Screw – Extruder Briquetting Machine
for Production of Charcoal Briquettes.” It consists of a mixture of charcoal powder and cassava starch
as binder with 20:1 ratio, where water, 40% of the mass of charcoal powder was added to the mixture
to produce charcoal briquette. It also covers the design of mechanical system of the automated
briquetting machine with automated cutting device for cutting charcoal briquettes in various and
desired lengths. It also has a replaceable die that can form square-shaped and hollowed hexagonal-
briquettes with cross-sectional areas of 1 in 2 and 1.75 in 2 . The briquettes were tested through 1 meter
drop test to determine the impact-shatter resistance of briquettes. Specifically, this machine can
produce 400 kg of briquettes throughout an 8-hour operation.",SDG: Goal 7: Affordable and Clean Energy
ME,MEC-46,https://drive.google.com/file/d/1rTa_68Eu4Bnn47dRvl4fnty5MP7w3K5o/view?usp=sharing,https://drive.google.com/uc?export=view&id=1rTa_68Eu4Bnn47dRvl4fnty5MP7w3K5o,Pulverize-Mixer,"SALVADOR, Gonzalo Jr., JOSE, Ma. Camille, INOCENCIO, Rive Mark T., KEMPIS, Vhanna Maris M., PUTIAN, Nicole Joyce B., TAGLE, Angela Mae V.",Electromechanical,Industrial Control and Automation,Design and Development of Carbonized Coconut Shell Pulverizer-Mixer to Produce Charcoal Dough for Briquette Production,https://drive.google.com/open?id=1yl67BKD3ificALSlkv9sVyx4gYd2WH8t,"The consequence of the agricultural sector is an abundance of agricultural waste. Coconut shell is one of
the most common agricultural wastes with harmful environmental effects. The Philippines has the most
coconut trees in the world, but the reported utilization rate is shallow. In truth, industries are capable of
producing a byproduct from coconut shells, but they frequently do not know how to use it. Reducing
appropriate size processes is the first step in densification. Pulverizing machines are considered as the
main equipment for crushing samples. The process of charcoal briquetting requires separate machines for
shredding, mixing, and briquetting that increases manual human labor and operation cost of manufacture.
Due to this problem, the study designed and developed a compact pulverizer-mixer to produce coconut
charcoal dough for briquette production. The main objective of this study is to develop a compact
pulverizer-mixer machine to help reduce coconut shell waste in the country. The machine contains a
pulverizer chamber at the top and a mixer chamber at the bottom. The pulverizer chamber has a hammer
mill rotor consisting of 8 blades for two rods and seven blades for the other 2 rods placed inside a circular
plate to pulverize the carbonized coconut shell during the process. The mixer chambers have a double
helical blade where the bigger blade has 290 mm for its outside diameter and the smaller blade has 210
mm for its inside blade. The machine can produce 62 kg of charcoal dough per hour after pulverizing and
mixing. The machine uses two electrical motors to help reduce noise pollution. A 1750 rpm motor runs
the pulverizer with an equivalent of 1 horsepower (Hp) and a 1750 rpm gear motor runs the mixer with a
ratio of 1:40. The hammer mill rotor can pulverize a carbonized coconut shell with a particle size of 1 mm
with a production rate of 40 kg per hour. On the other hand, the mixer can mix 15.5 kg of charcoal dough
in 15 minutes. Hence, the objectives are achieved, that is, to reduce coconut shell waste by producing
charcoal dough for the briquetting machine.",SDG: Goal 12: Responsible Consumption and Production
ME,MEC-50,https://drive.google.com/file/d/1Yft7WiEPTOBmIpCdqV0dA1KkB9gqUjL6/view?usp=share_link,https://drive.google.com/uc?export=view&id=1Yft7WiEPTOBmIpCdqV0dA1KkB9gqUjL6,PROJ.HEX,"CA-AY, Antiro M., GAZO, Alvin U., FLORDELIZA, Ralph Michael M.., CAMAJALAN, Harley David E., NAVAL, Marc Lawrence A., ONA, Almira L., PONFERRADA, Archie Jr. S.",Electromechanical,Mechanical Engineering Laboratory Apparatus,Design and Improvement of a Heat Exchanger Test Rig,https://drive.google.com/file/d/1ZbbyVhSOAhGEe5cRQz4qAYP6rLgLGDrO/view,"A heat exchanger is a widely used device that facilitates the transfer of thermal energy between fluids
of varying temperatures. These devices can be found in an industrial setting and are essential
components of most power plants. As mechanical engineering students at Technological University of
the Philippines - Manila, it becomes necessary to enhance their learning experience through hands-on
experimentation in a laboratory setting. The Mechanical Engineering Laboratory 2 courses aim to
broaden laboratory capabilities, leading to a requirement for new equipment like heat exchangers. To
fulfill this need, the proponents revamped an existing heat exchanger test rig conducted by previous
proponents at the mechanical engineering department of the Technological University of the
Philippines by redesigning, re-developing, rebuilding, reprogramming, and testing it. The
enhancements made to the original test rig enable students to assess the effectiveness of three distinct
heat exchanger types, namely shell and tube, double pipe, and fin-tube coil, in different configurations
such as counter, parallel, and crossflow. Through the improvement of this test rig, we can ensure
quality education by giving the students access to these types of laboratory apparatus that is normally
inaccessible in other state universities. The test rig also includes an additional installation of a water
chiller and insulated reservoir that is used for achieving a lower temperature for the cold fluid. The
existing Arduino-based instrumentation and interfacing system, which includes a DS18B20
temperature sensor, flow sensors, and a touchscreen HMI panel, will still be incorporated into the
design. The functionality and accuracy of the sensors used in the prototype were evaluated and
compared to their counterpart instruments, demonstrating that the heat exchanger test rig can perform
its intended function while also delivering sensor readings that are comparable to those obtained from
other instruments.",SDG: Goal 4: Quality Education
ECE,ECE-01,https://drive.google.com/file/d/1WDQ79bHHcvLwp7CYxibQOlYfV48pUJqd/view?usp=share_link,https://drive.google.com/uc?export=view&id=1WDQ79bHHcvLwp7CYxibQOlYfV48pUJqd,Aerophoenix,"MELEGRITO, Mark P., MERCADO, Kelvin G., FIRME, Crizar James A., ROBLE, Rica Joy B., SUATENGCO, Ralph Emerson R., TAMONDONG, Mary Queenie Joy R., VELASCO, Aya Yvonne S.",Info and Telco,Smart Agriculture,Strawberry Cultivation Monitoring and Control in a Smart Vertical Aeroponics System via Bayesian Network Through Internet-of-Things,https://drive.google.com/open?id=13UdZXD1aMggwB1Cs6pwX-khIbOVvFGnm,"Urban residents encountered trouble procuring food during the COVID-19 pandemic. Several studies
were conducted to increase the country&#39;s food sustainability and security to overcome and recover
from possibly catastrophic future unforeseeable disasters and tragedies. Soil-less culture and planting
within limited space were identified as viable alternative techniques in such circumstances. The
aeroponics technology is linked to the vertical farming approach. This method suspends roots in the
air inside a tower while delivering a fine mist of nutrients. The system includes a web application that
will monitor and govern the cultivation of strawberry plants gathered from the sensors and actuators.
It will also regulate the essential cultivation parameters acquired by agriculture sensors and actuators.
The system also has a predictive analytical model with a Bayesian network and time series chart,
utilizing the Raspberry Pi 4 Model B as the microcontroller, acting as a control and monitoring
system for the automated Aeroponics System. The system yields a maintaining value range of 5.7-6.0
(pH level), 735-786 (TDS level), 20.5-23.8 (water temperature), 20.1-31.5 (air temperature), and
31.7-95.3 (air humidity), which is within the ideal range of parameters suitable for strawberry plant
growth. Preliminary results indicate that the smart aeroponic system can significantly improve crop
yield and reduce resource consumption compared to traditional cultivation methods. However, further
data and analysis are needed to fully evaluate the system&#39;s performance and potential impact on
agriculture.",SDG: Goal 2: Zero Hunger
ECE,ECE-02,https://drive.google.com/file/d/1YEKmKrHk3EUPCIcFUQyDChcxeMOX4DUc/view?usp=share_link,https://drive.google.com/uc?export=view&id=1YEKmKrHk3EUPCIcFUQyDChcxeMOX4DUc,ANOVA,"RAMOS, John Peter M., AMADO, Coleen M., PERALTA, Mark Louie. M., AGOSTO, Charlz M.., GUBAT IV, Carlos B., LAGADON, Mary Kaye S., PARRA, Aira Joyce C.,",Info and Telco,E-Learning Technologies for Engineering Education,A Gamified Assessment for Checking Engineering Preparedness and Competency of Senior High School Students Utilizing Unity Game Engine,https://drive.google.com/open?id=1K2Kk_BEeOFbKc9SQAKgkDeVpFFp2byjb,"Gamification is a method similar to game – based learning which recently became notable to learning
organizations for its perceived benefits in the learning of students. Unlike traditional games, it is to be
treated as a design process of adding game elements to revise existing learning processes that students
experience now. Previous studies shown that gamification has been proven beneficial for learning, but
they failed to highlight any incorporation of gamification with assessments. Therefore, the purpose of
this study was to create a mobile gamified assessment for evaluating the preparedness and
competency of senior high school students in engineering. The assessment was implemented using the
Unity game engine, which allowed for the creation of an interactive and engaging learning
environment while assessing the user’s prowess in General Math and Sciences Subjects, Fundamental
Engineering subjects, and skills assessment. Then, the application will produce an overall percentage
which determines their competency in the featured engineering programs. The initial results of the
study showed that the gamified assessment was effective at identifying areas of strengths and
weaknesses among students, and at providing personalized feedback that helped them improve their
knowledge and skills in engineering. Essentially, the current implementation of the gamified
assessment utilizing Unity game engine turned out to be an effective approach for evaluating senior
high school students&#39; engineering readiness and competency.",SDG: Goal 4: Quality Education
