dept,code,group_logo,embed_link,group_name,proponents,main_categ,sub_categ,title,abstract,abstract_raw,sdg
EE,ELE-31,https://drive.google.com/file/d/1vd8Oj8bufPMbs4fqiNdQlX84ARp8zjyZ/view?usp=share_link,https://drive.google.com/uc?export=view&id=1vd8Oj8bufPMbs4fqiNdQlX84ARp8zjyZ,Project Power,"CURITANA, Cheerjoy, PADILLA, Jazel Loren A., ASPIRAS, Dave Jerald S., CASTRO, Bryan Rey S., HARLEA, James Rhussel M., LAMAGNA, Paul Joseph B., PAREDES, Wesley B.",Electromechanical,Power Generation and Energy Systems,Development of a Heat Transfer Mechanism for Biodiesel Fueled Stove to Power a Steam Engine Driven Axial Flux Generator ,https://drive.google.com/open?id=1tTeBti2WMMruUkJjZoMYJK5MOYzY3SA8,"Some areas in the Philippines does not have enough supply of electricity. Electric bills have
increased and overwhelmed most of the people. This project aims to provide a supply of
renewable energy in remote areas using Axial Flux generator and liquified petroleum gas free,
stove. Creating a petroleum-free stove, the user can cook using fire that is fueled by used
cooking oil. Then, an Axial Flux Generator connected to a heat engine will generate and provide
electricity. The target of this project are the people of some areas in the Philippines and provide
the electricity needed. Subsequently, utilizing recycled vegetable oil as a replacement for
standard petroleum-derived fuels like gasoline would reduce the price of gasoline by preserving
the supply of petroleum. Moreover, considered here are: its fire color that was produced by the
prototype; the type of wire or metal to be used preferably copper in this case based on the
studies; and even the kind of machine or engine to be used specifically the axial flux generator
over DC motor since it is more applicable and efficient in this research. Additionally, the engine
oil that was used is a waste product that clogs our canal with debris and prevents water flow. The
burning mechanism of this prototype is smoky due to the combustion of used oil, which was
discovered upon investigating the approach. Therefore, this project was advantageous for both
these areas and environment since this initiative utilized waste oil in a residential location,
residents were able to save money, and their energy bills were also kept from rising.",SDG: Goal 2: Renewable Energy/Electricity
EE,ELE-32,https://drive.google.com/file/d/1nC97Z9-1zmyt47ThRIDVoeAQLhrD8Rdv/view?usp=share_link,https://drive.google.com/uc?export=view&id=1nC97Z9-1zmyt47ThRIDVoeAQLhrD8Rdv,Project Sicco,"JUGANAS, Rey, BUBAN, John Carlo C., ALINDOGAN, James Vincent G., CARLA, Karla Ela R., ESTEBAN, Jhesriel B., PRESBITERO, Jan Sebastian M., YAMSUAN, Ejhay H.",Electromechanical,Smart Agriculture,Arduino-Based Fish Drying Machine through Air Preheating and Dehumidification,https://drive.google.com/open?id=1XQLNEI4cZBYgbRD9J8lvpOhczA-8KWr3,"Daing is an original preservation technique used in the Philippines and it works by removing water or
moisture from the fish that will inhibits the growth of microorganisms and prevents the process of decay.
Daing can mostly vary depending on the technique used and varies depending on the fish used, such as
galunggong, bisugo, espada and more. Philippines as a tropical country hinders the production of daing
during rainy seasons, also when it is summer season it consumes days to make daing. Unfortunately, there
are a lot of external factors that can affect the traditional way of producing daing, such as cats, air
pollutants, rains, and other parasites. As such, the researchers of this study aimed to develop a Arduino-
based fish frying machine through air preheating and dehumidification. Specifically, the machine has a
fish container that can accommodate 6-8 kg of fish, it consists of two heating elements, tungsten heater
for indoor use, and Fresnel lens for outdoor use that controlled by Arduino with alarm system,
temperature, and humidity sensor. The program provides a user-friendly display of setting the minimum
and maintaining temperature, and the time how long it will proceed to drying process. Three days of
testing with different time 8,9, and 7 hours respectively was conducted to three types of fish such as
Galunggong (small and medium), Bisugo, and Espada to gather results for drying time in 45-60 of
temperature. The results show the weight loss percentage of each fish to confirm the dryness and in Day 1
within 8 hours of drying process the average weight loss percentage of the test was 57%, for Day 2 within
9 hours of drying process the average weight loss percentage of the test was 66%, and for Day 3 within 7
hours of drying process the average weight loss percentage of the test was 53%. All the test was resulted
to 1% humidity at the end of their drying time.","SDG: Goal 9: Build resilient infrastructure, promote inclusive and sustainable industrialization and
foster innovation."
EE,ELE-34,https://drive.google.com/file/d/12EBWV2OBCVJPegh9a3QGX4zGFXuWg8FC/view?usp=share_link,https://drive.google.com/uc?export=view&id=12EBWV2OBCVJPegh9a3QGX4zGFXuWg8FC,PVDRAIN,"ACERO, Edward L., FALLARCUNA, Justine P., ANDAYA, Elgie S., BACOLOD, Andrea Jasmine R., PAMONAG, Ranch P., TANTUAN, Mel Lovely G., VERANO, Harold Philip N.",Electromechanical,Power Generation and Energy Systems,Development of Hydropower Turbine using Polyvinyl Chloride Material in Downspouts,https://drive.google.com/open?id=1kFg88i6vLGK6C_4cpB8mD8nbYEcZ81gR,"The increase in population and energy demand in recent years has resulted in the utilization of renewable
energy sources to alleviate the harmful effects of non-renewable energy sources on the environment.
Moreover, an untapped hydropower source potential is rainwater from downspouts which previous
studies show were implemented as small-scale hydropower systems. However, research about the
operation and maintenance of the material found that the problems of small hydropower turbines are
majorly caused by failure due to cavitation and silt erosion. As such, the researchers of this study aimed to
develop and analyze a pico-hydropower system with dual turbine using polyvinyl chloride as turbine
material in downspouts to determine the effectiveness of the material and the pico-hydropower system as
a renewable energy source for low-voltage devices. The results show that a 6-blade polyvinyl chloride
curved-blade turbine is best in terms of velocity and pressure as compared to an 8-blade and 10-blade
curved-blade turbine according to Flow Simulation with Computational Fluid Dynamics. The preliminary
testing of the pico-hydropower system with three trials at a 12-feet head downspout loaded with 10-12
liters of water at 24-30 seconds duration produced a maximum power output of 0.46765974 W for a
single turbine with load and 0.309814 W for a dual turbine with load.",SDG: Goal 7: Affordable and Clean Energy
EE,ELE-37,https://drive.google.com/file/d/1KhC-DWzDSityiJJHdTL-JSkd2e6sQnul/view?usp=share_link,https://drive.google.com/uc?export=view&id=1KhC-DWzDSityiJJHdTL-JSkd2e6sQnul,Salted EEgg,"ERIN, Jovencio V., ANGANA Chinie Sisley P., CARRETERO, Kyle Gerald D., DUMBRIGUE, Krishabelle S., INDUCIL, Angellika C., SOMBILLO, Edward S.",Electromechanical,Smart Agriculture,Automated Cleaning of Pre-Cured Salted Eggs with Candling and Grading,https://drive.google.com/open?id=14UrkChGZjMMTH20-8y36LoXSg7bfwci3,"The traditional practice of making salted eggs in the Philippines is done entirely by hand, from cleaning,
candling, and to grading by size. As a result, the process is time-consuming and labor-intensive. Manual
cleaning occasionally results in shell breakage and inconsistency, and manual egg candling and grading is
susceptible to human error and inefficient due to worker exhaustion from checking thousands of eggs per
day. With this dilemma, the study aims to develop an automated machine for cleaning, candling, and
grading of salted eggs. The automated machine was developed by assembling a conveyor for the cleaning
of eggs. It also includes soft bristle brushes and uses a pressure washer to clean the eggshell. In addition, a
camera module was used to capture images for scanning and an LED bulb for candling. The grading is
done with the assistance of load cells. The results showed that the system completed the cleaning stage
successfully. The cured salted eggs were thoroughly cleaned by the machine. Furthermore, it was efficient
at accurately categorizing salted eggs as good or bad using image processing-based candling. It was also
precisely graded by size as small, medium, and large. The system&#39;s accuracy is determined through
extensive testing.","SDG: Goal 9: Industry, Innovation, and Infrastructure"
EE,ELE-38,https://drive.google.com/file/d/1o8pE0ysOt18ujLf1I8RKbjrWaCixtUWB/view?usp=share_link,https://drive.google.com/uc?export=view&id=1o8pE0ysOt18ujLf1I8RKbjrWaCixtUWB,Power Wash,"CURITANA, Cheerjoy M., BARBONILLA, Kimberly, BERNARDO, Erica S., FERNANDEZ, John Joshua S., RIVERA, Nicole Jie A., SALINAS, Angelica S.",Electromechanical,Smart City,Solar-Powered Automated Hand Washing Machine with Fog Disinfection,https://drive.google.com/open?id=1oOWHPx6KQsm1xGilb-kRD1lT-nkEEcZk,"Hand hygiene is a crucial measure for reducing the transmission of pathogens and preventing outbreaks,
such as the COVID-19 pandemic. To address this issue, the present study aimed to develop a solar-
powered automated hand washing machine with fog disinfection, which can improve hand hygiene
practices in public areas. The system incorporates voice recognition technology, enabling hands-free
operation and minimizing the risk of cross-contamination. It dispenses water, soap, alcohol, and tissue,
and utilizes a photoelectric sensor and UV light to enhance the accuracy and effectiveness of the hand
washing process. During field testing, the automated hand washing machine improved hand hygiene
compliance, provided sustainability and cost-effectiveness, and offered an enhanced user experience.
However, the machine is not designed to be PWD-friendly, specifically for individuals with deafness or
speech impairment. Overall, this study presents a novel solution for promoting public health and safety,
particularly in high-traffic settings such as schools, offices, and hospitals. The automated hand washing
machine system can recognize voice commands despite variations in pitch and accent if the command is
articulated clearly.",SDG: Goal 6: Clean Water and Sanitation
EE,ELE-40,https://drive.google.com/file/d/1O-V_xhfyxbrJ_nQaY1-wRp0EicXBXza-/view?usp=share_link,https://drive.google.com/uc?export=view&id=1O-V_xhfyxbrJ_nQaY1-wRp0EicXBXza-,swEEpers,"JUGANAS, Rey S., OBANAN, Jimwell L., GACUTAN, Gerryvic M., LAGUNILLA, Vincent H., MENDOZA, Trixcia D., RECACHO, Jan-Mar A., VENDIVEL, Paulo P.",Electromechanical,Smart City,Arduino-Based Autonomous Sweeper and Trash Collector Robot for Even Surfaces,https://drive.google.com/open?id=1U3oD0ZYOKvj1Ovqq4D-hMHO1K7a6BDWE,"Cleanliness is an essential aspect of our lives, and it involves not only personal hygiene but also
environmental hygiene. Despite the importance of maintaining clean environments, most floor cleaning
tasks are still carried out by people, either entirely manually or by operating ride-on sweepers. In this
paper, the design and development of an Arduino-based autonomous sweeper and trash collector robot for
even surfaces was presented. The robot utilizes ultrasonic, infrared and proximity sensors to detect
obstacles and avoid collisions, while also incorporating a trash collector to efficiently clean up debris. The
robot is capable of operating in two distinct modes: an autonomous mode and a wireless-operated mode.
The former mode allows the robot to function independently by setting a specific dimension of the area
that will be cleaned, while the latter mode enables remote control via a mobile application and a Wi-Fi
module. The robot&#39;s autonomous capabilities were tested by programming it to navigate on even surfaces
and avoid obstacles while also picking up nearby municipal solid wastes. In addition, the effectiveness of
the robot&#39;s cleaning capabilities was evaluated by testing it on a simulated debris field. During the field
testing, an average collection and avoidance rate accuracy of 92.13% and 98.70% was achieved,
respectively. The results show that the Arduino-Based Autonomous Sweeper and Trash Collector Robot
can effectively clean the areas in even surfaces, which encourages less pollution and litter in public areas
like parks, streets, etc.",SDG: Goal 11: Sustainable Cities and Communities
EE,ELE-41,https://drive.google.com/file/d/1Nl51M41CfVCHYWdRQkiObYublgX7iVkM/view?usp=share_link,https://drive.google.com/uc?export=view&id=1Nl51M41CfVCHYWdRQkiObYublgX7iVkM,Synergy,"SEVILLA, Rovenson V., LASTRILLA, Adriano Aldrin Jr. B., CAMAGONG, Danica V., ESCABAL, Hannah Joy B., ENRIQUES, Winzelle Jord O., LABUCAY, Aina Marie M.",Electromechanical,Power Generation and Energy Systems,Energy Generation Performance of ITO Coated Glass Based Dye Sensitized Solar Cell Integrated in Window Blinds,https://drive.google.com/open?id=17ds3FIVJIBQ2m7-KUNnxy9bs_XcSUic5,"Dye-sensitized solar cells(DSSC) have become significant in the field of energy conversion. DSSCs
primarily consist of ITO coated conductive glass, dye, electrolytes, photo anode and counter electrode.
Natural dye is its main component for light absorption. With that, the study utilized leaves that have
chlorophyll and anthocyanin and considered pigments from (a) pineapple crown leaves, (b) muntingia
calabura(Aratiles) leaves and (c) purple potato leaves due to its abundance in the Philippines. The DSSC
will be integrated into venetian blinds, wherein Arduino Mega is used to set commands for its upward
and downward movement, tilting of its panels inward and outward, and using stepper motor and remote
control. As conductive glass is a crucial part of the study, Indium Tin Oxide (ITO) coated glass is used for
its conducting capacity. The titanium dioxide paste in the conductive electrode has been mixed with the
leaves extracts. And the counter electrolyte on the other panel is made of candle flame charcoal. This
research aims to maximize the advantage of the DSSC on energy harvesting. After several experiments
conducted, the researchers decided to use pineapple leaves extract as the essential of this research as it
produces a greater output than the other dyes. Pineapple leaves result with 0.480 V in a 460x50x1.1 mm
size of a panel. The ITO Coated Glass based blinds DSSC is expected to perform better both under
outdoor light conditions and diffused/indoor light conditions.",SDG: Goal 7 : Affordable and Clean Energy
EE,ELE-42,https://drive.google.com/file/d/1pQrql6DZCdqyev5Ck_DLYgSkXwzkKBWY/view?usp=share_link,https://drive.google.com/uc?export=view&id=1pQrql6DZCdqyev5Ck_DLYgSkXwzkKBWY,team DILIG,"PATIÑO, Fairy Charissel T., ACURATO, Alger O., LACIDA, Joesa Mae D., REYES, Simriel L., SY, Jericson",Electromechanical,Smart Agriculture,PV Powered Irrigation and Flood Control Pump System Using Arduino and Sensors,https://drive.google.com/open?id=1gOPmYlsReZ4DzSWhStbvKqf3Dl_6FMiL,"Heavy rains create floods in most low point locations resulting in excessive water exposure on crops.
On the other hand, crops must be monitored and watered on a regular basis during the intense
temperature to prevent them from drying. This study focuses on the development of a dual-purpose
irrigation and flood control system that will benefit the agriculture sector, which has the primary goal
of sustaining water supply and preventing crop damage. The two (2) primary processes are created by
developing and building the machine, which is powered by a photovoltaic (PV) system, Arduino has
been used as the major control component, as well as soil moisture and water level sensors. The
researchers thoroughly conducted tests and experiments in a remote location of 100 sqm. with a
growing plant of Okra (Abelmoschus esculentus). The irrigation test results showed that the water
content flows depend on the distance of the PVC pipe that delivers water from the reservoir to the
plant. Furthermore, data from soil moisture sensors shown and monitored before and after the
irrigation test were averaged. The simulation of flood revealed that the water flows and time intervals
to suction are affected by the motor submersible utilized and the elevation of the area away from the
crop. After examining the data and results, the researchers conclude that the pressure output of the
submersible pump and the design of the PVC pipe can influence the entire system, depending on the
amount of water delivered and the suction.",SDG: Goal 15: Life on Land
EE,ELE-43,https://drive.google.com/file/d/1MXegyHlWMD8O5MtjsyisSU3SZsWlEzkl/view?usp=share_link,https://drive.google.com/uc?export=view&id=1MXegyHlWMD8O5MtjsyisSU3SZsWlEzkl,TEAM GAMAS,"BAGUE, Lydon R., SISON, Piolo Jonel A., Francisco, Gerard Austin A., Magos, Michael Paul B., Montinola, Dann Loid C., Pantanilla, Juancho A., Sampaga, Howard G.",Electromechanical,Industrial Control and Automation,GPS-Guided Autonomous Lawn Mower with Solar Powered Charging Station,https://drive.google.com/file/d/11PS77CZzOLLDXSI_IoEn8gG6T0Mjnffj/view,"Lawn mowers are equipment that are used to uniformly cut grass in fields that are needed to be
maintained such as backyards, gardens, parks, etc. Existing lawn mowers are mostly gas powered and are
human operated by pushing the lawn mower through the field. This job becomes more tedious as the area
to be mown becomes larger. Hence, a system that is unmanned and environmentally friendly is needed. In
this paper, we designed and fabricated an automated lawn mower. An innovation of a device that can cut
grass without the need for human intervention and is powered by solar power through a solar charging
station at a base station for the lawn mower. The autonomous lawn mower features two modes of
operation which are the manual and autonomous mode. The manual mode features controls to operate the
lawn mower. Autonomous mode features a Real-Time Kinematics Global Positioning System (RTK-
GPS) based route planning used to create the pathing and obstacle avoidance of the lawn mower. A phone
application is used to facilitate the operation of the lawn mower. It also has sensors such as rain drop
sensor, ultrasonic sensor, gyroscope, and accelerometer which monitors conditions of the working
environment of the lawn mower. The base station has a solar panel installed which charges the batteries.
The base station also has a secondary RTK-GPS installed to provide correction signals. The finished
prototype was tested, and the automated lawn mower can cut grass using the RTK-GPS routed path
instructions it was given to.","SDG: Goal 9: Industry, Innovation and Infrastructure"
EE,ELE-45,https://drive.google.com/file/d/1XMsNaBye2ccrgbUW0cVDUdsugldV0YRB/view?usp=share_link,https://drive.google.com/uc?export=view&id=1XMsNaBye2ccrgbUW0cVDUdsugldV0YRB,Team Ube,"MERIN, Jovencio V., DELOTAVO, Norvin Michael R., FRANCISCO, Daniel Aaron C., JUSON, Jed Mars R., PEREDA, Argie Ian T., TAÑEDO, Jerico James R., ULANDAY, Paul Robin M.",Electromechanical,Smart Agriculture,"Arduino-Based Automated Purple Yam Jam Mixing, Cooking and Jar Filling Machine",https://drive.google.com/open?id=1d9qeNYxI9iA2NhfoA6rKVIYtjjKjZcHD,"The production of Purple Yam Jam is considered as one of the hardest foods to cook most especially
due to the labor it requires on mixing it due to its consistency. In addition to that, the process is also
time consuming. This then results to a reduced efficiency and productivity for business owners when
it comes to the Purple Yam Jam production. The study aims to create a machine that would aid the
workers in grinding, mixing and transferring the purple yam jam into jars. The automated purple yam
jam is developed by assembling different motors with different functions. It includes an AC geared
motor for mixing, tilting to filler and turn table. DC motors were also used for the trapdoor of the
filling machine and the vibration in order to concentrate the liquid into the hole of the funnel while the
machine tilts itself. A series of limiter switches was also included in order to properly adjust the
degrees of inclination. In addition, a series of solid-state relays were also used on controlling the AC
motors with the Arduino mega as a microcontroller. Finally, a customized induction cooker was also
installed on the machine that is also integrated with the microcontroller. The results showed that the
machine significantly increased the efficiency and productivity of the production of purple yam jam
due to its capability to handle continuous operation.","SDG: Goal 9: Industry, Innovation and Infrastructure."
EE,ELE-46,https://drive.google.com/file/d/1gbRQX97-p1SAtmhn-89bvkJgX9tnGcnF/view?usp=share_link,https://drive.google.com/uc?export=view&id=1gbRQX97-p1SAtmhn-89bvkJgX9tnGcnF,The Apula,"ESPINAS, Edwin O., JANDUSAY, Ronnel Arjay A., DIMACALI, Robie Lyn T., PRESNEDI, Erisse D., RAPIZ, Jhastine A., SEÑORIN, Marc Ivan Joshua B., TAMBA, Vincent B.",Electromechanical,Industrial Control and Automation,Autonomous Unmanned Ground Vehicle with Low Frequency Sonic Fire Extinguisher via Image Processing,https://drive.google.com/open?id=1NVsDIMeRTLyCrgTvb-wV3yrBmHesGG-w,"In recent years, finding quick and environmentally safe ways to put out flames has taken on particular
importance. The acoustic approach to flame suppression is one of the most promising. Since acoustic
waves can travel through solids, liquids, and gases, they can theoretically be used to put out fires of
many types. The technology mentioned can theoretically be used to put out B class fires when gases
or liquids are on fire. The investigations that are now available have only been done with low-power
acoustic extinguishers. Therefore, there is a theoretical and practical void in this area that has to be
filled. As a result of the activities, new methods for putting out fires employing high power
loudspeakers attached to acoustic extinguishers were developed using image processing. The main
goal of this paper is to present the possibilities of using image processing to detect fires as well as the
findings of research on the extinguishing of flames with the use of sine waveforms with Amplitude
Modulation (AM) for several frequencies, which is also a scientific novelty, including the minimum
acoustic power and sound pressure level as a function of a distance from the output of the acoustic
system. Based on this, it was possible to calculate the minimum power sent to the extinguisher and the
minimum sound pressure level that produces the extinguishing effect at specified input parameters –
class A, B, and K fires.","SDG: Goal 9: Industry, Innovation, and Infrastructure"
EE,ELE-47,https://drive.google.com/file/d/1kPM4kEZJ-8v_xjUlXV-qk3jVMLQKx3LK/view?usp=share_link,https://drive.google.com/uc?export=view&id=1kPM4kEZJ-8v_xjUlXV-qk3jVMLQKx3LK,Wandot,"HOLLMAN, Gilbert B., MARTIN, Kit Adrian B., ANTONIO, Mark Peter C., BALINAS, Abigail B., EXCEDENTE, Emmanuel A., FRANCISCO, Rommel Jr G., TATLONGHARI, Chezley Clint T.",Electromechanical,Smart City,Multi-Source Switching System for E-Scooter Charging Stand,https://drive.google.com/open?id=11ZgOnVTNe8iRbjK7Jg96mFAogAnmOoD_,"This study focuses on the development of a multi-source switching system for an E-scooter charging
stand using solar panels and a vertical axis wind turbine. The project will provide an uninterrupted
power supply for the charging stand allowing E-scooters to charge continually by selecting the most
suitable power source. The switching system utilizes cloud image mapping in which it identifies the
cloud coverage measurement and will switch in or out accordingly, and wind turbine speed
measurement using an infrared sensor that measures the revolution per minute of the VAWT. The
project was deployed at the Manila Baywalk Dolomite Beach and operated for 12hrs from 6 am to 6
pm to get the most of both the sunlight and wind energy. The data were gathered through the LCD
installed inside the compartment at the base of the project. During the 12-hour operation of the
machine, the solar power operated for 7 hours 36 minutes while the wind power operated for 4 hours
and 24 minutes where it switched 18 times. In the periods the solar power source was switched on, the
average current, voltage, and power were 1.247 amps, 20.5 volts, and 27.4 watts respectively. On the
other hand, the wind power averaged 2.341 amps, 10.3 volts, and 45.6 watts. Additionally, the wind
turbine averaged a speed of 26.7 rpm. The charging stand was also able to charge a total of 175%
during its 12-hour operation. In conclusion, the prototype successfully performed switching
operations and supplied energy to the charging stand.",SDG: Goal 7: Affordable and Clean Energy
